{"architecture":"x86_64","distribution":{"id":"ubuntu","os_release_path":"/usr/lib/os-release","version_id":"24.04"},"libc":{"family":"glibc","minimum_version":"2.39"},"name":"control-runtime-v1","node":{"archive_member":"node-v22.22.0-linux-x64/bin/node","archive_name":"node-v22.22.0-linux-x64.tar.xz","archive_sha256":"9aa8e9d2298ab68c600bd6fb86a6c13bce11a4eca1ba9b39d79fa021755d7c37","archive_size_bytes":30779824,"binary_sha256":"1bec56ef7cfa9a76f3e0b7c0a87f220eb73f23102b9c0b4c7529a3f7c3ce7c31","binary_size_bytes":123405064,"executable":"/opt/tratto-control/toolchains/node-v22.22.0-linux-x64/bin/node","provisioning":"root-owned-out-of-band","runtime_user":"tratto-control-web","source_url":"https://nodejs.org/dist/v22.22.0/node-v22.22.0-linux-x64.tar.xz","version":"v22.22.0"},"operating_system":"Linux","python":{"abi":"cp312","build_version":"3.12.13","cache_tag":"cpython-312","executable":"/usr/bin/python3.12","implementation":"CPython","major_minor":"3.12","patch_compatibility":"same-major-minor","py_debug":false,"runtime_users":["tratto-control-api","tratto-control-executor","tratto-control-fleet-migrator","tratto-control-migrator","tratto-control-proxy","tratto-control-web"],"soabi":"cpython-312-x86_64-linux-gnu"},"root_validation":{"artifact_interpreter_execution":false,"installed_policy_path":"/etc/tratto-control/runtime-policy.json","setpriv_executable":"/usr/bin/setpriv","trusted_runtime_metadata_only":true},"schema_version":1}
